{
  "schemaVersion": 1,
  "title": "탐구 수업 구성 예시",
  "language": "ko",
  "theme": "education",
  "slides": [
    {
      "id": "planning",
      "title": "화면 선택의 순서",
      "communication_goal": "화면 선택의 순서",
      "intent": "process",
      "summary": "이름이 아니라 사용 목적과 제약조건으로 선택합니다.",
      "layout": "process-flow",
      "blocks": [
        {
          "id": "pipeline",
          "module": "process",
          "data": {
            "items": [
              "목적 정하기",
              "후보 검색",
              "제약 검사",
              "슬롯 배치",
              "테마 적용",
              "화면 검증"
            ]
          }
        }
      ],
      "motion": [
        {
          "module": "sequence-step",
          "target": "pipeline",
          "reason": "조합기의 처리 순서를 한 단계씩 설명합니다."
        }
      ]
    },
    {
      "id": "lesson",
      "title": "학생 탐구의 다섯 단계",
      "communication_goal": "학생 탐구의 다섯 단계",
      "intent": "sequence",
      "summary": "순서가 필요한 내용은 타임라인으로 표현합니다.",
      "layout": "timeline",
      "blocks": [
        {
          "id": "ladder",
          "module": "timeline",
          "data": {
            "items": [
              "경험 떠올리기",
              "현황 살펴보기",
              "원인 질문하기",
              "대안 비교하기",
              "의견 정리하기"
            ]
          }
        }
      ],
      "motion": [
        {
          "module": "sequence-step",
          "target": "ladder",
          "reason": "탐구의 진행 순서를 단계별로 설명합니다."
        }
      ]
    },
    {
      "id": "motion-rule",
      "title": "모션보다 먼저 완성되는 의미",
      "communication_goal": "모션보다 먼저 완성되는 의미",
      "intent": "quote",
      "summary": "",
      "layout": "quote-focus",
      "blocks": [
        {
          "id": "principle",
          "module": "quote",
          "data": {
            "text": "정적 화면만으로도 메시지가 완성되어야 합니다. 모션은 그 의미를 설명하는 수단입니다.",
            "author": "공통 제작 원칙"
          }
        }
      ]
    }
  ]
}
